{
  "$schema": "https://json-schema.org/draft/2020-12/schema",
  "$id": "https://schemas.conductorone.com/multipass/secret-contracts/v1/password_v2.schema.json",
  "title": "password_v2",
  "x-secret-content-type": "password_v2",
  "description": "A login: a password with optional username, site URL and one-time-password enrollment URL.",
  "type": "object",
  "additionalProperties": false,
  "required": [
    "password"
  ],
  "properties": {
    "username": {
      "type": "string",
      "minLength": 1,
      "maxLength": 4096,
      "x-max-utf8-bytes": 131072
    },
    "password": {
      "type": "string",
      "minLength": 1,
      "maxLength": 4096,
      "x-max-utf8-bytes": 131072
    },
    "url": {
      "type": "string",
      "minLength": 1,
      "maxLength": 4096,
      "x-max-utf8-bytes": 131072,
      "x-semantic": [
        "http_url"
      ]
    },
    "otp_url": {
      "type": "string",
      "pattern": "^otpauth:\\/\\/",
      "minLength": 1,
      "maxLength": 4096,
      "x-max-utf8-bytes": 4096,
      "x-semantic": [
        "otp_uri"
      ]
    }
  },
  "x-max-document-bytes": 524288
}
