{"\u0075\u0073\u0065\u0072\u006e\u0061\u006d\u0065":"\u0061\u006c\u0069\u0063\u0065","\u0070\u0061\u0073\u0073\u0077\u006f\u0072\u0064":"\u0070\u00e4\u0073\u0073\u0020\u0022\u0077\u00f6\u0072\u0064\u0022\u0020\ud83d\udd11","\u0075\u0072\u006c":"\u0068\u0074\u0074\u0070\u0073\u003a\u002f\u002f\u0065\u0078\u0061\u006d\u0070\u006c\u0065\u002e\u0063\u006f\u006d\u002f\u006c\u006f\u0067\u0069\u006e","\u006f\u0074\u0070\u005f\u0075\u0072\u006c":"\u006f\u0074\u0070\u0061\u0075\u0074\u0068\u003a\u002f\u002f\u0074\u006f\u0074\u0070\u002f\u0045\u0078\u0061\u006d\u0070\u006c\u0065\u003a\u0061\u006c\u0069\u0063\u0065\u0040\u0065\u0078\u0061\u006d\u0070\u006c\u0065\u002e\u0063\u006f\u006d\u003f\u0073\u0065\u0063\u0072\u0065\u0074\u003d\u004a\u0042\u0053\u0057\u0059\u0033\u0044\u0050\u0045\u0048\u0050\u004b\u0033\u0050\u0058\u0050"}